{
  "$schema": "http://json-schema.org/draft-07/schema#",
  "$id": "https://example.com/cemetery.schema.json",
  "title": "Cemetery Data Schema",
  "description": "Schema for cemetery data including cemetery info, graves, and change logs",
  "type": "object",
  "required": ["schema_version", "cemetery", "graves", "change_log"],
  "properties": {
    "schema_version": {
      "type": "string",
      "description": "Version of the schema",
      "pattern": "^\\d+\\.\\d+\\.\\d+$",
      "default": "1.0.0"
    },
    "cemetery": {
      "type": "object",
      "description": "Cemetery information",
      "required": ["id", "name"],
      "properties": {
        "id": {
          "type": "string",
          "description": "Unique cemetery identifier"
        },
        "name": {
          "type": "string",
          "description": "Cemetery name"
        },
        "location": {
          "type": "string",
          "description": "Cemetery location or address"
        }
      }
    },
    "graves": {
      "type": "array",
      "description": "List of graves in the cemetery",
      "items": {
        "type": "object",
        "required": ["uuid"],
        "properties": {
          "uuid": {
            "type": "string",
            "description": "Unique grave identifier (UUID v4)",
            "pattern": "^[0-9a-f]{8}-[0-9a-f]{4}-4[0-9a-f]{3}-[89ab][0-9a-f]{3}-[0-9a-f]{12}$"
          },
          "section": {
            "type": "string",
            "description": "Cemetery section or plot"
          },
          "occupant": {
            "type": "string",
            "description": "Name of the deceased"
          }
        }
      }
    },
    "change_log": {
      "type": "array",
      "description": "History of changes to the cemetery data",
      "items": {
        "type": "object",
        "required": ["timestamp", "action"],
        "properties": {
          "timestamp": {
            "type": "string",
            "format": "date-time",
            "description": "When the change occurred"
          },
          "action": {
            "type": "string",
            "description": "Type of change (add, update, delete)"
          },
          "entity": {
            "type": "string",
            "description": "What was changed (grave, cemetery)"
          }
        }
      }
    }
  }
}
