{
  "schema_version": "1.0.0",
  "cemetery": {
    "id": "minimal-test",
    "name": "Minimal Example Cemetery",
    "grid": {
      "rows": 5,
      "cols": 5
    },
    "last_modified": "2025-10-03T12:00:00.000Z",
    "modified_by": "TestUser"
  },
  "graves": [
    {
      "uuid": "11111111-2222-4333-8444-555555555555",
      "plot": "A-1",
      "grid": {
        "row": 0,
        "col": 0
      },
      "properties": {
        "name": "Jane Doe",
        "last_modified": "2025-10-03T12:00:00.000Z",
        "modified_by": "TestUser"
      }
    },
    {
      "uuid": "aaaaaaaa-bbbb-4ccc-8ddd-eeeeeeeeeeee",
      "plot": "A-2",
      "grid": {
        "row": 0,
        "col": 1
      },
      "properties": {
        "birth": "1950-06-15",
        "death": "2020-12-01",
        "last_modified": "2025-10-03T12:00:00.000Z",
        "modified_by": "TestUser"
      }
    },
    {
      "uuid": "bbbbbbbb-cccc-4ddd-9eee-ffffffffffff",
      "plot": "B-1",
      "grid": {
        "row": 1,
        "col": 0
      },
      "properties": {
        "inscription": "Rest in Peace",
        "notes": "Near the oak tree",
        "last_modified": "2025-10-03T12:00:00.000Z",
        "modified_by": "TestUser"
      }
    },
    {
      "uuid": "cccccccc-dddd-4eee-afff-000000000000",
      "plot": "B-2",
      "grid": {
        "row": 1,
        "col": 1
      },
      "properties": {
        "last_modified": "2025-10-03T12:00:00.000Z",
        "modified_by": "TestUser"
      }
    }
  ],
  "change_log": []
}
